<?xml version="1.0"?>
<Workflow xmlns="http://www.wimo.inf.ed.ac.uk/stix" 
xmlns:xsi="http://www.w3.org/2001/XMLSchema-instance" 
xsi:schemaLocation="http://www.wimo.inf.ed.ac.uk/stix ../workflow/npmn.xsd ">

	<Metadata>
		<Name>Comprehensive Workflow</Name>
		<Author>Stix team</Author>
		<UUID>12345678-e29b-41d4-a716-446655440000</UUID>
		<Rev>1</Rev>
		<Notes>An example workflow with all events and tasks</Notes>
		<Enabled>true</Enabled>
		<Validity>
			<NotBefore>2009-01-01T09:00:00</NotBefore>
			<NotAfter>2010-12-31T09:00:00</NotAfter>
		</Validity>
	</Metadata>
	<AttributeSet>
		<Attribute>
			<Type>int</Type>
			<Name>evalAttribute</Name>
		</Attribute></AttributeSet>

	<Pool Query="ON location == SiteB DO" x="100" y="300">
		<MessageCatch id="stix-104">
			<FlowMapping>
				<out>stix-105</out>
			</FlowMapping>
			<DataMapping>
				<in>
					<parameter>
						<Name>messageName</Name>
						<Value>evalMsg</Value>
					</parameter></in>
				<out>
					<parameter>
						<Name>messageContent</Name>
						<Attribute>evalAttribute</Attribute>
						
					</parameter></out></DataMapping>
		</MessageCatch><MessageThrow id="stix-103">
			<FlowMapping>
				<out>stix-104</out>
			</FlowMapping>
			<DataMapping>
				<in>
					<parameter>
						<Name>messageName</Name>
						<Value>evalMsg</Value>
					</parameter>
					<parameter>
						<Name>messageContent</Name>
						<Value>12</Value>
					</parameter>
					<parameter>
						<Name>destination</Name>
						<Value>192.168.2.104</Value>
					</parameter></in></DataMapping>
</MessageThrow><StartTimerEvent id="stix-101" timer="2010-02-08T17:00:00"
			period="300000">
			<FlowMapping>
				<out>stix-102</out>
			</FlowMapping>
		</StartTimerEvent>

		<Task Clazz="uk.ac.ed.inf.wimo.stix.agent.task.GetSNR"
		URL="http://www.wimo.inf.ed.ac.uk/stix/GetSNR.class" 
		id="stix-102" x="100" y="300">
			<FlowMapping>
				<out>stix-103</out>
				<timeout>stix-103</timeout>
			</FlowMapping>
		</Task><Task URL="http://www.wimo.inf.ed.ac.uk/stix/Reboot.class" Clazz="uk.ac.ed.inf.wimo.stix.agent.task.Reboot" id="stix-106">
			<FlowMapping>
				<out>stix-108</out>
				<error>stix-108</error>
			</FlowMapping>
		</Task><Timer id="stix-108" duration="5000">
			<FlowMapping>
				<out>stix-104</out>
			</FlowMapping>
		</Timer>
	
		
		<Log id="stix-107">
			<FlowMapping>
				<out>stix-109</out>
			</FlowMapping>
			<DataMapping>
				<in>
					<parameter>
						<Name>message</Name>
						<Value>SNR OK!</Value>
					</parameter></in></DataMapping>
		</Log><EndPlainEvent id="stix-109" x="123" y="345"></EndPlainEvent><ExclusiveGateway id="stix-105">
			<FlowMapping>
				<out condition="evalAttribute == 10">stix-106</out>
				<out>stix-107</out>
			</FlowMapping>
</ExclusiveGateway>
		
		
		
		
	</Pool>
</Workflow> 
